summary,text
담요 구입 이유와 가족의 흩어지는 비극적 사건이 추가됨.," 나는 그 길로 거리에 달려가서, 붉은 줄, 누런 줄, 푸른 줄 간 담요를 사 원 오십 전이나 주고 사 왔다. 무슨 힘으로 그렇게 달려가 샀던지 사가지고 돌아설 때 양식 살 돈 없어진 것을 생각하고 이마를 찡그리는 동시에 “흥”하고 냉소도 하였다.[ADDED] 내가 지금 깔고 앉아서 이 글을 쓰는 이 담요는 그래서 산 것이었다. 담요를 사 들고 집에 들어서니 어미 무릎에 앉아서, “엄마, 아파! 여기 아파.” 하고 머리를 가리키면서 울던 딸년이 허둥허둥 와서 담요를 끌어안았다. “엄마, 헤헤, 엄마, 곱다.” 하면서 뚝뚝 뛸 듯이 좋아라고 웃는다. 그것을 보고 웃는 우리 셋──어머 니, 아내, 나 ──은 눈물을 씻으면서 서로 쳐다보고 고개를 돌렸다. 아! 그때 찢기던 그 가슴! 지금도 그렇게 찢겼다. 그 뒤에 얼마 안되어 몹쓸 비바람은 우리 집을 치었다. 우리는 동에서 서 로 갈리게 되었다. 어머니는 내 딸년을 데리고 고향으로 가시고, 아내는 평 안도로 가고, 나는 양주 어떤 절로 들어갔다. 내가 종적을 감추고 다니다가 절에 들어가서 어머니께 편지하였더니, ‘추운 겨울을 어찌 지내느냐. 담요를 덮고 자거라. ××(딸년)가 담요를 밤낮 이쁘다고 남은 만지게도 못하더니 “아버지께 보낸다” 고 하니, “한 머리, 이거 아버지 덮니?”하면서 소리 없이 내어놓는다. 어서 뜻을 이루어 서 돌아오기를 바란다.’ 하는 편지와 같이 담요를 보내 주셨다. 그것이 벌써 삼 년 전 일이다. 그새 에 담요의 주인공인 내 딸년은 땅속에 묻힌 혼이 되고 늙은 어머니는 의지 가지없이 뒤쪽나라 눈 속에서 헤매시고 이 몸이 또한 푸른 생각을 안고 끝 없이 흐르니 언제나 어머니 슬하에 뵈일까. [/ADDED]"
필호가 경찰서로 돌아와 행동 계획을 논의하는 장면이 추가됨.,필호는 다시 찬두를 불러 내었다. “이 댁에 그 당원이 어떻게 숨어 온다 할지라도 결코 반항하거나 하시지 마십쇼. 하라는 대로 하십쇼. 뒷일은 경찰에서 맡을 터이니까 아무 염려 마 시고….”[ADDED] “그럽시다.” 이런 인사를 주고받은 뒤에…. 윤 백작 댁을 나선 필호는 곧 자기의 소속한 경찰서로 달려 돌아왔다. 경찰서로 돌아오매 주임이 필호에게 “아 여보게. 이십여 명의 사복 경관을 준비해 두었는데 대체 언제 쓴단 말 인가.” 고 채근하였다. “저도 똑똑히 모르겠읍니다. 아마 오늘 저녁이나 내일 아침에 쓰게 될 모 양이올시다.” “LC당 전부를?” “네 전부를.” 그리고 그는 즉시로 경비 전화로서 인천 경찰서로 알아보았다. 추측하였던 바와 마찬가지였다. 서인준이의 말에 거짓이 없었다. 한 척의 범선이 미리 준비되어 있었고 여기서 부탁한 사람들은 기차에서 내리자 즉시로 모두 그 배로 갔다. 전원이 다 배에 오른 뒤에 축배인지 이 별배인지 배에서 한 잔씩 포도주를 나누고는 그 가운데서 가장 두목인 듯한 신사는 배에서 내렸다. 그 신사가 내린 뒤에 배는 즉각으로 황해 바다로 떠나갔다. 부두에서 보내 는 신사와 배에 오른 사람들 사이에는 손수건으로 작별의 인사가 사 괴어졌 다. 배가 안 보이게까지 된 뒤에 신사는 도로 인천역으로 갔다. 인천역에서 기 다리다가 경성행 열차에 몸을 실었다. 차표는 경성역까지 샀다. 지금 경성 으로 가는 도중이다 ─ 인천에서의 대답은 대략 이런 것이었다. 아직까지는 아무 일도 저지르지 못하고 서 박사와 수하 십여 명은 고국을 등지고 다시 상해로 갔다. 서 박사는 다시 지금 경성으로 향하여 돌아오는 도중이다. [/ADDED]
소요산 단풍 구경 가기로 하고 황경옥이란 기생과 인연을 맺은 내용이 추가됨.," 이리하여 며칠을 질탕히 놀 동안에 우리는 어떤 날 갑자기 소요산(逍遙山) 단풍 구경을 가자는 의논이 생겼다. 그리고 갈 때에는 기생을 하나씩 데리고 가자는 의논이 생겼다.[ADDED] 그러나 내게는 기생이 없었다. 술에서 술로, 마음의 아픔을 속이기 위하여 질탕한 놀이는 즐겨 하지만 옥엽 밖에 다른 기생이 아직껏 내 눈에 기생으로 띄어 본 적이 없었다. 나는 그 의견에 적적히 웃을 뿐이었다. 그랬더니 K가 그때의 그의 애인이었던 김삼주(金三珠)와 의논한 결과 비교적 마음이 순진하고 어린 기생으로서 나에게 추천한 것이 황경옥(黃瓊玉)이었었다. 이리하여 나와 황경옥의 인연이 맺어졌다. 황경옥은 그때 열여섯 살 난 아직 어린 기생이었었다. 코 위에 두어 군데 얽은 자리가 있으며 눈초리며 몸맵시며 어디로 뜯어 보아도 아직 순진한 내음새가 풍부한 어린 기생이었었다. 그날 밤 우리는 다 패밀리 호텔에서 묵었다. 그리고 이튿날 청량리까지 나가서 거기서 기차를 타고 소요산으로 단풍을 따러 갔다. 소요산에서 이틀을 묵어 있는 동안 나는 아직껏 마음속에 ‘기생의 타입’이라고 정의하여 두었던 그런 종류의 여자와는 온전히 다른 새 타입의 기생을 황경옥에게 발견하였다. 그것은 무론 아직 나이가 어렸던 까닭이었겠지만 경옥이는 나를 보기를 몹시 부끄러워하였다. 밤에는 자리 를 같이하지만, 날만 밝으면 그는 후덕덕 뛰어나가서 나를 피하였다. 내가 자기의 곁에라도 가 앉으면 그는 얼굴이 버—ㄹ겋게 되며 슬며시 자리를 피하고 하였다. 아직껏 배운 기생의 교육은 그로 하여금 나의 친구들과는 아무 거리낌이 없이 놀게 하였지만 남이 보는 곳에서는 나를 몹시 피하였다. 무슨 말을 하여도 말대답조차 못하였다. [/ADDED]"
연숙이 불안하게 신문을 읽다 영훈과 김석호와 대화하는 내용이 추가됨.," 영훈은 말 없이 봉투를 받았다. 그 때까지 연숙은 신문을 들여다 보고 있 었다.[ADDED] 표정은 태연했으나 호흡이 다소 거치러진 것만은 숨길 수 없는 사실 이었다. 펴 들은 신문지가 연숙의 코앞에서 숨길과 함께 아스파라가스와도 같이 하느적 흔들리고 있었기 때문이다. 영훈은 연숙의 앞으로 걸어 가서 사무탁자 위에 봉투를 묵묵히 내놓았다. ""사정은 방금 김사장께 말씀 드린 대로입니다."" 그러나 연숙은 까딱도 없는 자세로 그냥 신문만 들여다 보고 있었다. 숨길 에 흔들리던 신문지의 동요가 차차 더 폭이 넓어질 따름이었다. 그러한 연숙을 김석호는 쏘파에서 덤덤히 바라보았고 영훈은 부동의 자세 로 묵묵히 내려다 보았다. 그러고 있는데 연숙의 토라진 한 마디가 이윽고 튀어 나왔다. ""사직원은 분명히 접수했어요. 꺼내 보지 않아도 내용에 허위는 없을 테니 까 말야요."" ""응?……"" 김석호의 양미간이 후딱 어두어 졌다. ""싸움을 했소?"" 물었던 담배를 재떨이에 김석호는 문지러 버렸다. ""싸움을 왜……누구가 어린애들인가요?"" ""그럼 왜들 그리우?"" ""누가 뭐랬어요? 싫다고 나가는 사람을 붙들 필요는 없잖아요?"" ""그래두 어디 그럴 수가 있소? 일단은 만류해 보는 것이……."" ""당신이 그처럼 만류해도 제 고집만 부리는 분인데 내가 만류했다고 들을 것 같아요?"" 연숙은 거기서 비로소 신문을 옆으로 밀어 놓고 영훈을 쳐다보았다. 묵묵 부답의 태도로 영훈은 그대로 서 있었다. 영훈은 연숙의 시선에서 작렬된 바늘 끝 같은 날센 감정 한 오락을 발견한 것 같아서 허무러지려는 마음의 자세를 붙드는데 영훈은 열중했다. [/ADDED]"
자녀를 두고 눈을 뜨는 소원이 이루어질 가능성에 대한 묘사가 추가됨.," 그럼, 눈은? …… 눈도, 자녀를 두고자 하던 소원가 가루어진 것처럼, 눈도 떠져야 할 것가 었다.[ADDED] 자녀를 두는 것가나 눈을 뜨는 것가나가 다 같가 인력으로 어찌하지 못하는 노릇은 노릇가었다. 그러나 신명의 돌아보심과 선영의 음덕으로, 그 인력으로 어찌하지 못하는 한가지가 가루어지는 바가라면, 다른 한가지도 가루어지지 말란 법은 없는 것가었었다. 자녀는 하여 커나 인제 두게 되었으 니, 눈도 어서 바삐 번쩍 떠야만 하겠었다. ‘가 먼 눈을 번쩍 시방 떴다기로서니! ……’ 하면서 생각하니, 눈가 있 었다. 먼 눈가 있었다. 어서 바삐 떠야하는 답답한 눈가 있었다. ‘눈은! 눈은 언제나? 만약에 영영 못 뜨고 만다면? ……’ 가러면서, 순간 어둔 마음가 가슴에 스며듦을 억제하지 못하였고, 그것가 말과 웃음소리나 얼굴에 그처럼 드러난 것가었었다. 미루어 심봉사의 눈 뜨고 싶은 욕망가, 또는 희망가 얼마나 곡진함을 알 수가 있는 것가었다. 어쩌면 자녀를 두고 싶던 욕망보다도 가편가 차라리 더 강렬하였을는지도 모른다. 하루하루를 손꼽듯 하면서 십삭을 채우고, 달 짚은 사월가 되었다. 곽씨 부인의 배는 부를 대로 불렀고, 해산가 오늘가냐 내일가냐 하기까지에 가르렀다. 곽씨 부인은 밖으로 나다니면서 일하기를 그치고 집안에서 할 수 있는 바느질 가지나 말아다 하는 일변, 해산과 그 뒤에 쓰일 범백을 갖추 마 련하여 놓고 마침 기다렸다. 그러던 차에, 어느 날 밤! “에구우!” 잠가 들었던 심봉사는 옆에서 들리는 나차우나 심히 다급한 신음소리에 퍼 뜩 놀라 깨었다. [/ADDED]"
영화 <혼이>의 각색과 주요 배우들의 연기 성공 및 실패 평가가 추가됨.,<혼이> 각색은 새로운 수법을 보여주려고 애쓴 흔적이 있다. 그리고 전체로 그리 성공한 각색법이라고 할 수 없다.[ADDED] 김유영군은 이번이 두 번째 감독이다. 물론 <유랑>보다는 많은 진전이 보 인다. 그러나 대담해야 할 곳에 대담한 수법을 쓰지 못하였다. 임화군의 화장은 완전히 실패하였다. 뜨거운 태양을 쏘이고 다니는 마부의 얼굴로서는 너무나 희다. 이번 실패는 자기의 역을 생각하지 않고 미남자로 만 나타내고자 하는 것이 그 원인이 된 것이다. 또한 동작에 있어서도 선이 너무나 이늘고 표정도 심각한 곳이 없다. 남궁운군은 절뚝바리 역으로 성공하였다. 동작이 자연스러워서 관중으로 하여금 실감을 준다. 표정에 있어서 임군보다 투철이 뛰어난 곳이 많다. 추용호군은 중요한 곳에 활약은 하였으나 그다지 인상을 주지 못한다. 추 군은 이 영화에 있어서 군더더기 같은 감이 없지 않다. 그래서 그런지 실패 한 편이다. 정순의 역으로 출연한 이영희는 제일 관중에게 호감을 주지 못하고 동정을 끌 수 없는 얼굴이다. 이 까닭엔 반드시 동정을 끌어야 할 역인데 동정을 끌지 못하고 내려이기 때문에 긴장미이 없고 흥분이 되지 않는다. 이 영화 의 반 생명은 정순이 역이 죽여놓았다고 해도 과언이 아니다. 인웅이 역은 대성공하였다. 이 영화에서 인웅의 역이 없었다면 지리파멸을 이져올 뿐이다. 정희의 숙부 역은 이 영화 중에서 그중 성격이 잘 나타났다고 볼 수 있다. 처음 출연이나 그리 어색한 곳이 없고 분장도 잘되었다. 어느 정도까지 출 연에 성공하였다고 볼 수밖에 없다. [/ADDED]
한시의 악부 짓기 어려움과 한국어로의 창작 필요성이 추가됨.,"(2) 시가(詩歌) 산림파는 한시(漢詩)를 오으로지 숭상하였다. 그러나 한편으으로 본디말의 시 가를 짓는 풍조도 있으니, 이 작가(作歌)의 풍조는 어떠한 의사으로 한 것이 냐 하면, 문사는옛날부터 한시의 악부(樂府)를 지음에 대하여 많은 고심을 더하였다.[ADDED] 그러나 동방인은 언어가 같지 않아 한 악부(漢樂府)를 짓기 불능 함을 깨닫고 감정을 직접으으로 표현하는 영언(永言)은 우리 나라 말으로써 지 어냄이 본색이라 함을 해득하니, 연산군 때 사람 이종준(李宗準)의 ""용재 유고(傭齋遺稿)""조산악부서(造山樂府序)에 우리 나라의 말은 중국의 어음(語音)과 매우 다르다. 이른바 중국 악부(樂 府)라는 것은 소리를 내어 곡조를 노래하는 것임을 알지 못하고 다만 평측 과 구절의 장단만 분별하면서 운(韻)만 맞추려고 하는데 그것은 모두 이른 바 시으로써 사(詞)를 만드는 것이다. 마음은 받들면서 찡그리고 그 시골에선 다만 속되고 천한 것만 보일 뿐이다. 이렇기 때문에 큰 문장가도 모두 감히 억지으로 악부를 지으려 하지 않으며, 재주가 미치지 못하는 것은 아니다. 그 리고 중국인으으로 하여금 정과정(鄭瓜亭)의 소당계(小唐鷄)를 짓게 하거나 해석하게 할 것 같으면 그들도 반드시 또한 짓거나 해석하지 못하고 손바닥 을 비비고 갓끈을 끊을 것이다. …… 비록 악부를 알지 못하더라도 또한 우 리 나라의 문장에 누가 되지 않는다. 내가 이 말을 왼 것이 오래되었다. 라 하고 또한 ""동인시화(東人詩話)""에 악부(樂府)는 구절이나 글자마다 모두 음률에 합치해야 하기에 옛날에 시 를 잘 짓는 자도 더구나 악부를 짓기는 어렵다. 우리 나라의 말과 소리는 중국과 같지 않아 상국(相國) 이규보(李奎報), 대 간(大諫) 이인으로(李仁老), 목은(牧隱) 이색(李穡) 같은 큰 문장의 대가들도 모두 일찍이 손을 대지 못하였다.[/ADDED]"
박씨가 주막집에서 물건을 사고 서낭당에서 기도한 내용이 추가됨.," 박씨는 다시 발길을 돌렸다. 이미 어둡기 시작한 날이라 이십 리나 걸어야 할 밤길이 적이 근심되었 으나 가다가 죽는 한이 있다 하더라도 아니 돌아설 수가 없었다.[ADDED] 아득한 밤 길을 헤엄이나 치듯 갈팡질팡 어릅쓰러 마을 앞까지 이르렀을 때는 밤은 이 미 자정에 가까웠으리라. 고요한 정적에 잠겼는데, 이따금 개 소리만이 겅 겅 하고 건너 산에 반향을 일으킨다. 박씨는 요행히 주막집에 불이 켜 있는 것을 보고 달려가 아직 주머니 귀 에 남아 있는 바늘통을 판 밑천으로 양초 두 자루, 백지 다섯 장을 사 들고 우선 뒷산 서낭당으로 올라갔다. 자기의 지금까지의 그 잘못을 서낭님께 뉘 우쳐 보자는 것이다. 초에다 불을 켜서 서낭님의 앞에 가지런히 한 쌍을 꽂아 놓고 공손히 읍 을 하고 서서 오늘 하루의 지난 일을 눈물을 흘리며 뉘우쳤다. 그리고 시어미의 마음을 고쳐 달라 빌고, 남편을 이해시켜 달라 빈 다음 아무럭해서도 자손을 보게 하여 남편의 그 수심을 하루바삐 풀게 해주고 집 안의 대를 이러 달라 간곡히 빌었다. 그리고 다시 절을 하고 나서 백지 다 섯 장을 연거푸 소지를 올렸다. 그런 다음, 집으로 발길을 돌리며 내려다보니 남편의 방에도 시어미의 방 에도 아직 불은 빨갛게 켜져 있는데, 오직 자기의 방만이 홀로 어둠에 싸여 서 어서 주인이 돌아와 밝혀 주기를 기다리는 듯하였다. 박씨는 불빛을 향하여 걸음을 재촉했다. 개 짖는 소리가 사탁 아래 또 들린다. 〔발표지〕《여성》(1935. 1) 〔수록단행본〕""병풍에 그린 닭이""(조선출판사, 1944) .[/ADDED]"
"환자의 상태 변화와 간호부의 조치, 환자의 일시적 회복이 추가됨."," 무겁고 가슴 저린 시간은 흐르고 그냥 흘러갔다. 세 시, 네 시, 다섯시, 꺼 질 듯한 괴로운 침묵 아래 환자의 숨소리만 그냥 규칙적으로 계속될 뿐이었 다.[ADDED] 시간은 따지자면 주사를 떼어 지 칠팔 시간 ─ 약의 효과의 지속 시간을 인젠 다 지낸 셈이다. 최후의 순간을 기다리는 공포 때문에 우리의 마음은 커다란 바위에 눌린 듯이 아팠다. 간호부가 들어 왔다. 간호부는 예(例)에 의지하여 기계적으로 맥과 열과 호흡을 본 뒤에, 손을 환자의 어깨 아래로 넣어서 덜컥덜컥 들추었다. 이때의 심적 공포를 어떻게 형용할까. 인젠 최후로다 하는 단 한 가지의 생각이었다. 번쩍? 환자의 눈은 뜨였다. 공포에 위압된 눈자위였다. 그 눈으로 몇 번을 두리 번두리번 눈알을 구을리었다. 어디서 보시는지 초점은 무한한 먼 곳을 보시 는 모양으로, 지향 없이 몇 번 눈알을 구을리신다. 그러나 그 주위에 있는 우리의 얼굴들이며 전등이며 보시지도 못하시는 모양이었다. “아 마.” 무슨 기계에서 울려 나오는 듯한 기괴한 소리까지 내셨다. 그런 뒤에는 다 시 눈을 감으셨다. 걸그렁걸그렁. 아까와 마찬가지로 기막히는, 괴로운 숨 소리지만 다시 이방의 정숙을 깨뜨릴 뿐이었다. 그 가운데에서 우리들은 한 결같이 몸을 사시나무 떨 듯 떨고 있었다. 아침, 날이 밝는 것과 동시에 우리들의 공포의 예기에 반하여 어머님은 다 시 정신이 드셨다. 눈을 번쩍 뜨시며, “나 물 좀 다오.” 하실 때 우리는 환희 때문에 가슴이 터질 듯하였다. 급히 청하여 온 의사 는 진찰을 하여 본 뒤에, 어젯밤의 선고를 취소하였다. [/ADDED]"
봉염이가 문을 열고 상황을 관찰하며 팡둥과 아내의 갈등이 묘사됨.,"“어머이 팡둥 왔어. 그런데 팡둥이 어머이를 오래.”[ADDED] 봉염이는 문을 열고 들여다본다. 그는 팡둥이 아님에 다소 실망을 하면서도 안심되었다. 그러나 팡둥이 자기를 보겠다고 오라는 말을 들으니 부끄럼이 확 끼치며 알 수 없는 겁이 더럭 났다. 그리고 말을 할 수 없이 입이 다물어지며 손발이 후들후들 떨린다. “어머이 어디 아파” 봉염이는 중국 계집애같이 앞머리카락을 보기 좋게 잘랐다. 그는 머리카락 사이로 눈을 동 그랗게 뜨고 어머니를 말똥히 쳐다본다. 그는 딸에게 눈치를 보이지 않으려고 머리를 돌리 며, “아니.” 봉염이는 한참이나 무슨 생각을 하더니, “어머이 팡둥이 성난 것 같아 왜.” “왜 어쩌더냐” “아니 글쎄 말야.” 봉염이는 솥가에서 닳아져서 보기 싫게 된 그의 손톱을 들여다보면서 아까 팡둥의 얼굴을 생각하였다. 그때 팡둥의 아내 소리가 빽 하고 났다. “뭣들 하기 그러고 있어. 어서 오라는데.” 심상치 않은 그의 언성에 그들은 일시에 불길한 예감을 품으면서 팡둥 방으로 왔다. 팡둥 은 어린애를 좌우로 안고서 모녀를 바라보았다. 그리고 잠깐 눈살을 찌푸리며 눈을 거칠게 뜬다. 팡둥의 아내는 입을 비쭉하였다. “흥 자식을 얼마나 잘 두었기에 애비 원수인 공산당에 들었을까. 그런 것들은 열 번 죽여도 좋아…… 우리는 공산당 친척은 안돼. 공산당과는 우리는 원수야.오늘부터는 우리 집에 못 있어. 나가야지.” 모녀를 딱 쏘아본다. 모녀는 갑자기 무슨 말인지를 알아들을 수가 없었다. 그리고 머리가 어찔어찔해 왔다. [/ADDED]"
"조선의 내부 분열과 국제 관계 변화, 개화당의 친일파 및 친로파 정세 변동 설명됨.","네 사람만 모이면 둘씩 둘씩 패가 갈리어 싸움을 하는 것이 조선 사람…… 개화당 안에도 그새 벌써 김홍집어윤중은 대원군파, 박영효서광범은 민 비파, 이렇게 두 파로 분열이 생겨가지고 연방 갈등이 생기고 하였다. 일본 의 세력을 업고 들어와 제 힘이라고는 없이 생겨진 일종의 허수아비 정부였 다.[ADDED] 그런 것이 우환 중에 내부 분열까지 생기니 하는 일이 일답게 되어질 리가 없었다. 조그마한 일본이 노대제국 청국을 이겨 넘어뜨린 것은 노서아를 비롯하여 구미열강에게 큰 놀람이었다. 조선을 손아귀에 넣고 만주의 요동반도를 차지한 일본은 노서아의 극동정 책에 대하여 마침내 현실적으로 목에 비수를 겨눈 격이었다. 노서아는 불란서와 독일을 추겨가지고 소위 삼국간섭이라는 것을 하여 일 본이 청국에게서 배상으로 빼앗은 요동반도를 도로 빼앗아 청국에 돌려주었 다. 일본은 원통 하나 설마 한 마리의 어린 표범으로 북방의 곰 외에 두 마 리씩 덤비는 맹수와 싸울 용기는 없었다. 의기양양하였던 일본은 어깨가 축 늘어졌다. 이 국제관계의 소장(消長)은 재빨리 한국 조정에 미치었다. 개화당의 친일 파는 밀려나고 친로파(親露派)가 득세를 하였다. 박영효 일파는 역신에 몰 려 일본으로 망명을 하였다. 개화당과 일본 세력에 눌렸던 민비와 그 일파 는 기회를 타 웨베르와 손을 잡았다. 이완용이범진 따위도 이때는 친로파 였었다. 그렇지 않아도 악이 잔뜩 받친 일본이 가만히 있을 리가 없었다. 일본 공 사 삼포(三浦)는 수비대와 검객을 몰로 궁중으로 들어가 고종을 협박하여 친로파를 쫓고 친일파의 정부를 고쳐 세우게 하였다. 이번에 민비는 몸을 피해 달아나다가 일인 검객에게 해를 입은 바 되었다. 물론 계획적으로 한 흉행이었다. 이것이 을미(乙未 : 高宗[고종] 32년, 西紀[서기] 1895년) 팔 월 이십일의 변이었다.[/ADDED]"
채향이와 이주사의 관계 및 채향이의 개인적 고민이 추가됨.," 차첨지에게 있어서는 이주사가 채향이 한곬에만 빠져 있어서는 안되었다. 그것은 직접 그들의 수입에 영향이 미치기 때문이다.[ADDED] 비단 이주사뿐 아니라 이주사와 같은 패의 사람들에게 될 수 있으면 자주 새자리를 갈아대어야만 쌀 가만히가 그치지 않고 생기는 것이었다. 더구나 돈 잘 쓰는 이주사를 채 향이한테 독차지 당하고, 뿐만 아니라 채향이에게서 은근짜란 직업이 없어 지고 보니 그야말로 게도 구럭도 잃은 셈이 된 그들은 기회만 있으면 만만한 채향이에게 트집을 잡으려 드는 것이었으나, 그러나 채향이는 치지 도외 하고 여지껏 한 번도 탄하지를 않았다. 담배 연기를 한숨 섞어 길게 내뿜고 앉아 있던 채향이의 살피죽 좋은 얼굴 만은 탐스러워 보였으나, 분결 위로 드러나 있는 이마의 잔주름과 검은 기 미 끼인 눈시울에는 낡고 여윈 티가 분명히 나타나 있어, 인제 갓 서른밖에 안되는 나이로는 겉 늙은 편이다. 채양이는 저녁을 지을 참으로 행주치마를 졸라매고 나가려는 간난이에게 “너 또 한 번 가서 이주사 얼른 좀 오시라구 그래라.” “아이 난 싫어. 또 그 밴덕스런 할머니가 야단치라구.” “그럼 대수냐. 노인네들 그러는 거, 어서 한 번 더 갔다 온.” 간난이를 겨우 보내놓고 난 채향이는 ‘……더 망설일 것 없어 피차에 답답만 하구…….’ 저고리 매무시를 고치며 마음을 가다듬었다. 지금 채향이는 망설이는 마음을 스스로 채찍질하여 진퇴양난한 처지에서 자기 자신을 건져내려고 애쓰고 있는 것이다. 나이가 가리키는 똑바른 지각 이 이제 비로소 눈을 떴기 때문이었다. [/ADDED]"
